p.value	odds_ratio	overlap	adj_p.value	genes
Regulation of Insulin-like Growth Factor (IGF) transport and uptake by Insulin-like Growth Factor Binding Proteins (IGFBPs) R-HSA-381426	8.31410579513419e-06	9.5298847928911	8/44	0.0220656367802861	PLG;CDH2;IGF1;IGF2;PAPPA;IGFBP4;PAPPA2;IGFBP5
Activation of the TFAP2 (AP-2) family of transcription factors R-HSA-8866907	0.000269868705836287	40.8092467567437	3/6	0.122619594520039	TFAP2A;WWOX;TFAP2C
CDC42 GTPase cycle R-HSA-9013148	0.000262020957824106	5.4999525269064	8/70	0.122619594520039	CDC42;TRIO;SPATA13;IQGAP2;WDR81;FGD4;SH3PXD2A;ARHGAP20
Calcitonin-like ligand receptors R-HSA-419812	0.000137377080051435	61.2232991486867	3/5	0.122619594520039	IAPP;RAMP1;CALCB
Negative regulation of activity of TFAP2 (AP-2) family transcription factors R-HSA-8866904	0.000269868705836287	40.8092467567437	3/6	0.122619594520039	TFAP2A;WWOX;TFAP2C
Signaling by Receptor Tyrosine Kinases R-HSA-9006934	0.000277210839156079	2.8033450231856	19/327	0.122619594520039	BRAF;NRAS;PLG;MAPK12;WWOX;CDC42;RICTOR;CTNND1;PTK2;MUC20;PTK2B;ERBB3;LAMA5;SPRED2;PTPN3;SGK1;IGF1;IGF2;INSR
Recycling of bile acids and salts R-HSA-159418	0.000463881331706973	30.6557453748406	3/7	0.153892631793788	ABCB11;SLC10A1;SLCO1A2
SHC-related events triggered by IGF1R R-HSA-2428933	0.000463881331706973	30.6557453748406	3/7	0.153892631793788	NRAS;IGF1;IGF2
Amino acid transport across the plasma membrane R-HSA-352230	0.00150736334684287	17.5316122130943	3/10	0.306795134903781	SLC16A10;SLC38A2;SLC7A2
DCC mediated attractive signaling R-HSA-418885	0.0010741753374763	20.4497127461886	3/9	0.306795134903781	CDC42;PTK2;TRIO
Invadopodia formation R-HSA-8941237	0.00175171447033106	80.6553629728127	2/3	0.306795134903781	ADAM19;SH3PXD2A
Negative regulation of MAPK pathway R-HSA-5675221	0.00146842670184619	9.71161537000294	4/21	0.306795134903781	BRAF;NRAS;MAPK12;PTPN3
Peptide hormone metabolism R-HSA-2980736	0.00143976521447006	6.93227577095248	5/35	0.306795134903781	BCHE;IGF1;ANPEP;PCSK1;REN
TFAP2 (AP-2) family regulates transcription of other transcription factors R-HSA-8866906	0.00175171447033106	80.6553629728127	2/3	0.306795134903781	TFAP2A;TFAP2C
Transcriptional regulation by the AP-2 (TFAP2) family of transcription factors R-HSA-8864260	0.00146842670184619	9.71161537000294	4/21	0.306795134903781	TFAP2A;WWOX;TFAP2C;MYBL2
VEGFA-VEGFR2 Pathway R-HSA-4420097	0.00184955620137924	4.46836136160468	7/73	0.306795134903781	NRAS;MAPK12;CDC42;RICTOR;CTNND1;PTK2;PTK2B
Synthesis, secretion, and deacylation of Ghrelin R-HSA-422085	0.00203596225019115	15.3336885744767	3/11	0.31784963600043	BCHE;IGF1;PCSK1
Signaling by VEGF R-HSA-194138	0.00233762214372421	4.27092082723106	7/76	0.344669398302447	NRAS;MAPK12;CDC42;RICTOR;CTNND1;PTK2;PTK2B
Bile acid and bile salt metabolism R-HSA-194068	0.0034054532240655	12.268089858966	3/13	0.397809478827686	ABCB11;SLC10A1;SLCO1A2
Metabolism of ingested SeMet, Sec, MeSec into H2Se R-HSA-2408508	0.00344748229579381	40.4067700995884	2/4	0.397809478827686	MAT1A;AHCY
SUMOylation of transcription factors R-HSA-3232118	0.0034054532240655	12.268089858966	3/13	0.397809478827686	MDM2;TFAP2A;TFAP2C
TFAP2 (AP-2) family regulates transcription of cell cycle factors R-HSA-8866911	0.00344748229579381	40.4067700995884	2/4	0.397809478827686	TFAP2A;TFAP2C
TFAP2A acts as a transcriptional repressor during retinoic acid induced cell differentiation R-HSA-8869496	0.00344748229579381	40.4067700995884	2/4	0.397809478827686	TFAP2A;MYBL2
Sulfur amino acid metabolism R-HSA-1614635	0.00425779160327442	11.1545494594293	3/14	0.470840788128763	MAT1A;AHCY;MTAP
RAS signaling downstream of NF1 loss-of-function variants R-HSA-6802953	0.00565421910628873	26.9780217006592	2/5	0.600251900323612	NRAS;SPRED2
Regulation of TP53 Degradation R-HSA-6804757	0.00718071824230023	5.88400580372864	4/32	0.732985623656339	MDM2;RICTOR;SGK1;CCNG1
Myogenesis R-HSA-525793	0.00889108271764254	8.17577694993899	3/18	0.786564451087443	MAPK12;CDC42;CDH2
Netrin-1 signaling R-HSA-373752	0.00889108271764254	8.17577694993899	3/18	0.786564451087443	CDC42;PTK2;TRIO
Regulation of CDH11 function R-HSA-9762292	0.00834639430651493	20.249508512106	2/6	0.786564451087443	ADAM19;CTNND1
Regulation of TP53 Expression and Degradation R-HSA-6806003	0.00802024290823487	5.67998511081296	4/33	0.786564451087443	MDM2;RICTOR;SGK1;CCNG1
SLC-mediated transmembrane transport R-HSA-425407	0.00953088687487151	3.62160900079453	6/75	0.815966895674483	SLC16A10;SLC38A2;SLC7A2;SLC4A7;SLCO1A2;SLC13A5
Metabolism of Angiotensinogen to Angiotensins R-HSA-2022377	0.0114993994964381	16.2062213577518	2/7	0.897629595986668	ANPEP;REN
Methylation R-HSA-156581	0.0114993994964381	16.2062213577518	2/7	0.897629595986668	MAT1A;AHCY
Sensory perception of taste R-HSA-9717189	0.0114993994964381	16.2062213577518	2/7	0.897629595986668	SCN9A;SCNN1D
Drug ADME R-HSA-9748784	0.0131827059956265	4.83964520794004	4/38	0.999625763211221	PON1;BCHE;SLCO1A2;SULT1E1
2-LTR circle formation R-HSA-164843	1	0	0/5	1	
5-Phosphoribose 1-diphosphate biosynthesis R-HSA-73843	1	0	0/0	1	
A tetrasaccharide linker sequence is required for GAG synthesis R-HSA-1971475	1	0	0/10	1	
ABC transporter disorders R-HSA-5619084	0.792728166140886	0.639126997381932	1/63	1	ABCB11
ABC transporters in lipid homeostasis R-HSA-1369062	1	0	0/10	1	
ABC-family proteins mediated transport R-HSA-382556	1	0	0/77	1	
ABO blood group biosynthesis R-HSA-9033807	1	0	0/2	1	
ADORA2B mediated anti-inflammatory cytokines production R-HSA-9660821	1	0	0/21	1	
ADP signalling through P2Y purinoceptor 1 R-HSA-418592	1	0	0/14	1	
ADP signalling through P2Y purinoceptor 12 R-HSA-392170	1	0	0/11	1	
AKT phosphorylates targets in the cytosol R-HSA-198323	0.257575809211835	3.64679299205737	1/12	1	MDM2
AKT phosphorylates targets in the nucleus R-HSA-198693	1	0	0/10	1	
AKT-mediated inactivation of FOXO1A R-HSA-211163	1	0	0/4	1	
ALK mutants bind TKIs R-HSA-9700645	1	0	0/3	1	
ALKBH2 mediated reversal of alkylation damage R-HSA-112122	1	0	0/0	1	
ALKBH3 mediated reversal of alkylation damage R-HSA-112126	1	0	0/0	1	
AMPK inhibits chREBP transcriptional activation activity R-HSA-163680	1	0	0/6	1	
APC truncation mutants are not K63 polyubiquitinated R-HSA-5467333	1	0	0/1	1	
APC truncation mutants have impaired AXIN binding R-HSA-5467337	1	0	0/10	1	
APC-Cdc20 mediated degradation of Nek2A R-HSA-179409	1	0	0/22	1	
APC/C-mediated degradation of cell cycle proteins R-HSA-174143	1	0	0/80	1	
APC/C:Cdc20 mediated degradation of Cyclin B R-HSA-174048	1	0	0/23	1	
APC/C:Cdc20 mediated degradation of Securin R-HSA-174154	1	0	0/66	1	
APC/C:Cdc20 mediated degradation of mitotic proteins R-HSA-176409	1	0	0/71	1	
APC/C:Cdh1 mediated degradation of Cdc20 and other APC/C:Cdh1 targeted proteins in late mitosis/early G1 R-HSA-174178	1	0	0/71	1	
APC:Cdc20 mediated degradation of cell cycle proteins prior to satisfation of the cell cycle checkpoint R-HSA-179419	1	0	0/69	1	
APEX1-Independent Resolution of AP Sites via the Single Nucleotide Replacement Pathway R-HSA-5649702	1	0	0/2	1	
APOBEC3G mediated resistance to HIV-1 infection R-HSA-180689	1	0	0/5	1	
ARL13B-mediated ciliary trafficking of INPP5E R-HSA-5624958	1	0	0/0	1	
ARMS-mediated activation R-HSA-170984	0.094419081422319	13.3756306771223	1/4	1	BRAF
ASP-3026-resistant ALK mutants R-HSA-9717264	1	0	0/0	1	
ATF4 activates genes in response to endoplasmic reticulum  stress R-HSA-380994	1	0	0/24	1	
ATF6 (ATF6-alpha) activates chaperone genes R-HSA-381183	1	0	0/9	1	
ATF6 (ATF6-alpha) activates chaperones R-HSA-381033	1	0	0/11	1	
ATF6B (ATF6-beta) activates chaperones R-HSA-8874177	1	0	0/4	1	
ATP sensitive Potassium channels R-HSA-1296025	1	0	0/1	1	
AUF1 (hnRNP D0) binds and destabilizes mRNA R-HSA-450408	1	0	0/53	1	
AURKA Activation by TPX2 R-HSA-8854518	0.228979569212431	2.3026702302593	2/37	1	ODF2;HAUS4
AXIN missense mutants destabilize the destruction complex R-HSA-5467340	1	0	0/10	1	
Abacavir ADME R-HSA-2161522	1	0	0/3	1	
Abacavir metabolism R-HSA-2161541	1	0	0/1	1	
Abacavir transmembrane transport R-HSA-2161517	1	0	0/2	1	
Abasic sugar-phosphate removal via the single-nucleotide replacement pathway R-HSA-73930	1	0	0/1	1	
Aberrant regulation of mitotic G1/S transition in cancer due to RB1 defects R-HSA-9659787	1	0	0/17	1	
Aberrant regulation of mitotic cell cycle due to RB1 defects R-HSA-9687139	1	0	0/35	1	
Aberrant regulation of mitotic exit in cancer due to RB1 defects R-HSA-9687136	1	0	0/19	1	
Abnormal conversion of 2-oxoglutarate to 2-hydroxyglutarate R-HSA-2978092	1	0	0/0	1	
Abortive elongation of HIV-1 transcript in the absence of Tat R-HSA-167242	1	0	0/19	1	
Acetylation R-HSA-156582	1	0	0/2	1	
Acetylcholine Neurotransmitter Release Cycle R-HSA-264642	1	0	0/5	1	
Acetylcholine binding and downstream events R-HSA-181431	1	0	0/5	1	
Acetylcholine inhibits contraction of outer hair cells R-HSA-9667769	1	0	0/1	1	
Acetylcholine regulates insulin secretion R-HSA-399997	1	0	0/4	1	
Acrosome Reaction and Sperm:Oocyte Membrane Binding R-HSA-1300645	1	0	0/1	1	
Activated NOTCH1 Transmits Signal to the Nucleus R-HSA-2122948	1	0	0/15	1	
Activated NTRK2 signals through CDK5 R-HSA-9032845	1	0	0/5	1	
Activated NTRK2 signals through FRS2 and FRS3 R-HSA-9028731	0.159390357214264	6.69070020831284	1/7	1	NRAS
Activated NTRK2 signals through FYN R-HSA-9032500	1	0	0/4	1	
Activated NTRK2 signals through PI3K R-HSA-9028335	1	0	0/5	1	
Activated NTRK2 signals through PLCG1 R-HSA-9026527	1	0	0/2	1	
Activated NTRK2 signals through RAS R-HSA-9026519	0.138263077540289	8.02961050373643	1/6	1	NRAS
Activated NTRK3 signals through PI3K R-HSA-9603381	1	0	0/4	1	
Activated NTRK3 signals through PLCG1 R-HSA-9034793	1	0	0/1	1	
Activated NTRK3 signals through RAS R-HSA-9034864	0.116610297001326	10.0369720650775	1/5	1	NRAS
Activated PKN1 stimulates transcription of AR (androgen receptor) regulated genes KLK2 and KLK3 R-HSA-5625886	1	0	0/60	1	
Activated point mutants of FGFR2 R-HSA-2033519	1	0	0/4	1	
Activation and oligomerization of BAK protein R-HSA-111452	1	0	0/1	1	
Activation of AKT2 R-HSA-165158	1	0	0/3	1	
Activation of AMPA receptors R-HSA-399710	1	0	0/0	1	
Activation of AMPK downstream of NMDARs R-HSA-9619483	1	0	0/26	1	
Activation of APC/C and APC/C:Cdc20 mediated degradation of mitotic proteins R-HSA-176814	1	0	0/72	1	
Activation of ATR in response to replication stress R-HSA-176187	1	0	0/12	1	
Activation of BAD and translocation to mitochondria  R-HSA-111447	1	0	0/14	1	
Activation of BH3-only proteins R-HSA-114452	1	0	0/25	1	
Activation of BIM and translocation to mitochondria  R-HSA-111446	1	0	0/3	1	
Activation of BMF and translocation to mitochondria R-HSA-139910	1	0	0/1	1	
Activation of C3 and C5 R-HSA-174577	1	0	0/5	1	
Activation of Ca-permeable Kainate Receptor R-HSA-451308	0.094419081422319	13.3756306771223	1/4	1	NCALD
Activation of G protein gated Potassium channels R-HSA-1296041	1	0	0/11	1	
Activation of GABAB receptors R-HSA-991365	1	0	0/18	1	
Activation of HOX genes during differentiation R-HSA-5619507	1	0	0/95	1	
Activation of IRF3, IRF7 mediated by TBK1, IKKε (IKBKE) R-HSA-936964	1	0	0/14	1	
Activation of Matrix Metalloproteinases R-HSA-1592389	0.257575809211835	3.64679299205737	1/12	1	PLG
Activation of NF-kappaB in B cells R-HSA-1169091	0.807813888199776	0.609162039295566	1/66	1	NFKB1
Activation of NIMA Kinases NEK9, NEK6, NEK7 R-HSA-2980767	1	0	0/4	1	
Activation of NMDA receptors and postsynaptic events R-HSA-442755	0.770776533343108	0.683901389904292	1/59	1	NRAS
Activation of NOXA and translocation to mitochondria R-HSA-111448	1	0	0/5	1	
Activation of Na-permeable kainate receptors R-HSA-451307	1	0	0/0	1	
Activation of PPARGC1A (PGC-1alpha) by phosphorylation R-HSA-2151209	0.159390357214264	6.69070020831284	1/7	1	MAPK12
Activation of PUMA and translocation to mitochondria R-HSA-139915	1	0	0/7	1	
Activation of RAC1 R-HSA-428540	1	0	0/10	1	
Activation of RAC1 downstream of NMDARs R-HSA-9619229	1	0	0/5	1	
Activation of RAS in B cells R-HSA-1169092	0.116610297001326	10.0369720650775	1/5	1	NRAS
Activation of SMO R-HSA-5635838	1	0	0/7	1	
Activation of TRKA receptors R-HSA-187015	1	0	0/3	1	
Activation of anterior HOX genes in hindbrain development during early embryogenesis R-HSA-5617472	1	0	0/95	1	
Activation of caspases through apoptosome-mediated cleavage R-HSA-111459	1	0	0/2	1	
Activation of gene expression by SREBF (SREBP) R-HSA-2426168	0.449301491930106	1.73970235420524	1/24	1	ACACB
Activation of kainate receptors upon glutamate binding R-HSA-451326	0.257575809211835	3.64679299205737	1/12	1	NCALD
Activation of the AP-1 family of transcription factors R-HSA-450341	1	0	0/10	1	
Activation of the mRNA upon binding of the cap-binding complex and eIFs, and subsequent binding to 43S R-HSA-72662	1	0	0/49	1	
Activation of the phototransduction cascade R-HSA-2485179	1	0	0/6	1	
Activation of the pre-replicative complex R-HSA-68962	1	0	0/14	1	
Activation, myristolyation of BID and translocation to mitochondria R-HSA-75108	1	0	0/3	1	
Activation, translocation and oligomerization of BAX R-HSA-114294	1	0	0/2	1	
Acyl chain remodeling of CL R-HSA-1482798	1	0	0/4	1	
Acyl chain remodeling of DAG and TAG R-HSA-1482883	1	0	0/3	1	
Acyl chain remodelling of PC R-HSA-1482788	1	0	0/10	1	
Acyl chain remodelling of PE R-HSA-1482839	1	0	0/9	1	
Acyl chain remodelling of PG R-HSA-1482925	1	0	0/6	1	
Acyl chain remodelling of PI R-HSA-1482922	1	0	0/7	1	
Acyl chain remodelling of PS R-HSA-1482801	1	0	0/6	1	
Adaptive Immune System R-HSA-1280218	0.970528368993104	0.487700599512866	5/393	1	NRAS;NFKB1;CDC42;RICTOR;CTSB
Adenosine P1 receptors R-HSA-417973	1	0	0/2	1	
Adenylate cyclase activating pathway R-HSA-170660	1	0	0/5	1	
Adenylate cyclase inhibitory pathway R-HSA-170670	1	0	0/7	1	
Adherens junctions interactions R-HSA-418990	0.0176666657872449	6.1259989614668	3/23	1	CDH2;ADAM19;CTNND1
Adipogenesis R-HSA-9843745	0.500038233125335	1.21174406337467	2/68	1	NFKB1;NCOR2
Adrenaline signalling through Alpha-2 adrenergic receptor R-HSA-392023	1	0	0/2	1	
Adrenaline,noradrenaline inhibits insulin secretion R-HSA-400042	0.275804974610652	3.34253800995413	1/13	1	CACNB2
Adrenoceptors R-HSA-390696	1	0	0/3	1	
Advanced glycosylation endproduct receptor signaling R-HSA-879415	1	0	0/11	1	
Aerobic respiration and respiratory electron transport R-HSA-1428517	0.935352361162003	0.362587407440806	1/109	1	PDK2
Aflatoxin activation and detoxification R-HSA-5423646	1	0	0/6	1	
Aggrephagy R-HSA-9646399	1	0	0/33	1	
Agmatine biosynthesis R-HSA-351143	1	0	0/0	1	
Alanine metabolism R-HSA-8964540	1	0	0/0	1	
Alpha-defensins R-HSA-1462054	1	0	0/3	1	
Alpha-oxidation of phytanate R-HSA-389599	1	0	0/3	1	
Alpha-protein kinase 1 signaling pathway R-HSA-9645460	1	0	0/9	1	
Alternative Lengthening of Telomeres (ALT) R-HSA-9006821	1	0	0/1	1	
Alternative complement activation R-HSA-173736	1	0	0/2	1	
Amine Oxidase reactions R-HSA-140179	1	0	0/1	1	
Amine ligand-binding receptors R-HSA-375280	1	0	0/3	1	
Amino Acid conjugation R-HSA-156587	1	0	0/4	1	
Amino acids regulate mTORC1 R-HSA-9639288	1	0	0/40	1	
Amplification  of signal from unattached  kinetochores via a MAD2  inhibitory signal R-HSA-141444	0.560101313454734	1.24768986946656	1/33	1	CENPC
Amplification of signal from the kinetochores R-HSA-141424	0.560101313454734	1.24768986946656	1/33	1	CENPC
Amyloid fiber formation R-HSA-977225	0.881070648858286	0.469086411977571	1/85	1	IAPP
Anchoring fibril formation R-HSA-2214320	1	0	0/13	1	
Anchoring of the basal body to the plasma membrane R-HSA-5620912	0.302172375222059	1.87066933725177	2/45	1	ODF2;HAUS4
Androgen biosynthesis R-HSA-193048	1	0	0/2	1	
Antagonism of Activin by Follistatin R-HSA-2473224	1	0	0/2	1	
Anti-inflammatory response favouring Leishmania parasite infection R-HSA-9662851	1	0	0/42	1	
Antigen Presentation: Folding, assembly and peptide loading of class I MHC R-HSA-983170	1	0	0/20	1	
Antigen activates B Cell Receptor (BCR) leading to generation of second messengers R-HSA-983695	1	0	0/16	1	
Antigen processing-Cross presentation R-HSA-1236975	1	0	0/86	1	
Antigen processing: Ubiquitination & Proteasome degradation R-HSA-983168	1	0	0/152	1	
Antimicrobial peptides R-HSA-6803157	1	0	0/16	1	
Antiviral mechanism by IFN-stimulated genes R-HSA-1169410	1	0	0/109	1	
Apoptosis R-HSA-109581	0.834686862458403	0.614903783578346	2/130	1	PTK2;CFLAR
Apoptosis induced DNA fragmentation R-HSA-140342	1	0	0/10	1	
Apoptotic cleavage of cell adhesion  proteins R-HSA-351906	1	0	0/4	1	
Apoptotic cleavage of cellular proteins R-HSA-111465	0.391579993155526	2.10789506975962	1/20	1	PTK2
Apoptotic execution phase R-HSA-75153	0.537563527052307	1.33152259035122	1/31	1	PTK2
Apoptotic factor-mediated response R-HSA-111471	1	0	0/9	1	
Aquaporin-mediated transport R-HSA-445717	1	0	0/21	1	
Arachidonate production from DAG R-HSA-426048	1	0	0/4	1	
Arachidonic acid metabolism R-HSA-2142753	0.406548576822922	2.00206904638143	1/21	1	PON1
Aromatic amines can be N-hydroxylated or N-dealkylated by CYP1A2 R-HSA-211957	1	0	0/0	1	
Aryl hydrocarbon receptor signalling R-HSA-8937144	1	0	0/6	1	
Asparagine N-linked glycosylation R-HSA-446203	0.874630906256633	0.552252121766599	2/144	1	GNE;ST3GAL1
Aspartate and asparagine metabolism R-HSA-8963693	1	0	0/4	1	
Aspirin ADME R-HSA-9749641	0.257575809211835	3.64679299205737	1/12	1	BCHE
Assembly Of The HIV Virion R-HSA-175474	1	0	0/9	1	
Assembly and cell surface presentation of NMDA receptors R-HSA-9609736	1	0	0/31	1	
Assembly and release of respiratory syncytial virus (RSV) virions R-HSA-9820962	1	0	0/2	1	
Assembly of Viral Components at the Budding Site R-HSA-168316	1	0	0/2	1	
Assembly of active LPL and LIPC lipase complexes R-HSA-8963889	1	0	0/9	1	
Assembly of collagen fibrils and other multimeric structures R-HSA-2022090	0.611799434181177	1.0777306023585	1/38	1	CTSB
Assembly of the ORC complex at the origin of replication R-HSA-68616	1	0	0/58	1	
Assembly of the pre-replicative complex R-HSA-68867	1	0	0/127	1	
Association of TriC/CCT with target proteins during biosynthesis R-HSA-390471	1	0	0/22	1	
Astrocytic Glutamate-Glutamine Uptake And Metabolism R-HSA-210455	1	0	0/2	1	
Asymmetric localization of PCP proteins R-HSA-4608870	1	0	0/58	1	
Atorvastatin ADME R-HSA-9754706	0.0716761816406873	20.053402141104	1/3	1	PON1
Attachment and Entry R-HSA-9678110	1	0	0/1	1	
Attachment and Entry R-HSA-9694614	1	0	0/7	1	
Attachment of GPI anchor to uPAR R-HSA-162791	1	0	0/2	1	
Attenuation phase R-HSA-3371568	1	0	0/19	1	
Autodegradation of Cdh1 by Cdh1:APC/C R-HSA-174084	1	0	0/63	1	
Autodegradation of the E3 ubiquitin ligase COP1 R-HSA-349425	1	0	0/51	1	
Autointegration results in viral DNA circles R-HSA-177539	1	0	0/3	1	
Autophagy R-HSA-9612973	0.900403856827687	0.432222011292048	1/92	1	MTMR3
Axon guidance R-HSA-422475	0.857327973491037	0.690788571553793	6/343	1	NRAS;CDC42;CACNB2;PTK2;TRIO;SCN9A
Axonal growth inhibition (RHOA activation) R-HSA-193634	1	0	0/2	1	
Axonal growth stimulation R-HSA-209563	1	0	0/2	1	
Azathioprine ADME R-HSA-9748787	1	0	0/11	1	
B-WICH complex positively regulates rRNA expression R-HSA-5250924	1	0	0/75	1	
BBSome-mediated cargo-targeting to cilium R-HSA-5620922	1	0	0/11	1	
BDNF activates NTRK2 (TRKB) signaling R-HSA-9024909	1	0	0/1	1	
BH3-only proteins associate with and inactivate anti-apoptotic BCL-2 members R-HSA-111453	1	0	0/8	1	
BMAL1:CLOCK,NPAS2 activates circadian gene expression R-HSA-1368108	1	0	0/20	1	
Bacterial Infection Pathways R-HSA-9824439	0.639881594737349	0.996174411655497	1/41	1	CTNND1
Base Excision Repair R-HSA-73884	1	0	0/53	1	
Base-Excision Repair, AP Site Formation R-HSA-73929	1	0	0/43	1	
Basigin interactions R-HSA-210991	1	0	0/11	1	
Beta defensins R-HSA-1461957	1	0	0/6	1	
Beta oxidation of butanoyl-CoA to acetyl-CoA R-HSA-77352	1	0	0/5	1	
Beta oxidation of decanoyl-CoA to octanoyl-CoA-CoA R-HSA-77346	1	0	0/2	1	
Beta oxidation of hexanoyl-CoA to butanoyl-CoA R-HSA-77350	1	0	0/3	1	
Beta oxidation of lauroyl-CoA to decanoyl-CoA-CoA R-HSA-77310	1	0	0/3	1	
Beta oxidation of myristoyl-CoA to lauroyl-CoA R-HSA-77285	1	0	0/1	1	
Beta oxidation of octanoyl-CoA to hexanoyl-CoA R-HSA-77348	1	0	0/2	1	
Beta oxidation of palmitoyl-CoA to myristoyl-CoA R-HSA-77305	1	0	0/0	1	
Beta-catenin independent WNT signaling R-HSA-3858494	1	0	0/105	1	
Beta-catenin phosphorylation cascade R-HSA-196299	1	0	0/11	1	
Beta-oxidation of pristanoyl-CoA R-HSA-389887	1	0	0/3	1	
Beta-oxidation of very long chain fatty acids R-HSA-390247	1	0	0/4	1	
Bicarbonate transporters R-HSA-425381	0.0716761816406873	20.053402141104	1/3	1	SLC4A7
Binding and Uptake of Ligands by Scavenger Receptors R-HSA-2173782	1	0	0/20	1	
Binding and entry of HIV virion R-HSA-173107	1	0	0/4	1	
Binding of TCF/LEF:CTNNB1 to target gene promoters R-HSA-4411364	1	0	0/8	1	
Biogenic amines are oxidatively deaminated to aldehydes by MAOA and MAOB R-HSA-141333	1	0	0/1	1	
Biological oxidations R-HSA-211859	0.271291249659913	1.70481137820467	3/74	1	MAT1A;SULT1E1;AHCY
Biosynthesis of A2E, implicated in retinal degradation R-HSA-2466712	1	0	0/0	1	
Biosynthesis of D-series resolvins R-HSA-9018676	1	0	0/2	1	
Biosynthesis of DHA-derived SPMs R-HSA-9018677	1	0	0/5	1	
Biosynthesis of DHA-derived sulfido conjugates R-HSA-9026395	1	0	0/0	1	
Biosynthesis of DPA-derived SPMs R-HSA-9018683	1	0	0/3	1	
Biosynthesis of DPAn-3 SPMs R-HSA-9025094	1	0	0/3	1	
Biosynthesis of DPAn-3-derived 13-series resolvins R-HSA-9026403	1	0	0/1	1	
Biosynthesis of DPAn-3-derived maresins R-HSA-9026290	1	0	0/1	1	
Biosynthesis of DPAn-3-derived protectins and resolvins R-HSA-9026286	1	0	0/2	1	
Biosynthesis of DPAn-6 SPMs R-HSA-9025106	1	0	0/1	1	
Biosynthesis of E-series 18(R)-resolvins R-HSA-9023661	1	0	0/3	1	
Biosynthesis of E-series 18(S)-resolvins R-HSA-9018896	1	0	0/3	1	
Biosynthesis of EPA-derived SPMs R-HSA-9018679	1	0	0/4	1	
Biosynthesis of aspirin-triggered D-series resolvins R-HSA-9020265	1	0	0/2	1	
Biosynthesis of electrophilic ω-3 PUFA oxo-derivatives R-HSA-9027604	1	0	0/2	1	
Biosynthesis of maresin conjugates in tissue regeneration (MCTR) R-HSA-9026762	1	0	0/0	1	
Biosynthesis of maresin-like SPMs R-HSA-9027307	1	0	0/0	1	
Biosynthesis of maresins R-HSA-9018682	1	0	0/2	1	
Biosynthesis of protectin and resolvin conjugates in tissue regeneration (PCTR and RCTR) R-HSA-9026766	1	0	0/0	1	
Biosynthesis of protectins R-HSA-9018681	1	0	0/1	1	
Biosynthesis of specialized proresolving mediators (SPMs) R-HSA-9018678	1	0	0/6	1	
Biosynthesis of the N-glycan precursor (dolichol lipid-linked oligosaccharide, LLO) and transfer to a nascent protein R-HSA-446193	0.0922083198075985	4.25675981296695	2/21	1	GNE;ST3GAL1
Biotin transport and metabolism R-HSA-196780	0.138263077540289	8.02961050373643	1/6	1	ACACB
Blockage of phagosome acidification R-HSA-9636467	1	0	0/0	1	
Blood group systems biosynthesis R-HSA-9033658	1	0	0/4	1	
Branched-chain amino acid catabolism R-HSA-70895	0.219743962439726	4.45902578431031	1/10	1	HIBADH
Breakdown of the nuclear lamina R-HSA-352238	1	0	0/1	1	
Budding and maturation of HIV virion R-HSA-162588	1	0	0/16	1	
Butyrate Response Factor 1 (BRF1) binds and destabilizes mRNA R-HSA-450385	1	0	0/15	1	
Butyrophilin (BTN) family interactions R-HSA-8851680	1	0	0/4	1	
C-type lectin receptors (CLRs) R-HSA-5621481	0.556994164944957	1.04076561181963	3/118	1	NRAS;NFKB1;MUC20
C6 deamination of adenosine R-HSA-75102	1	0	0/0	1	
CASP8 activity is inhibited R-HSA-5218900	0.219743962439726	4.45902578431031	1/10	1	CFLAR
CD163 mediating an anti-inflammatory response R-HSA-9662834	1	0	0/6	1	
CD209 (DC-SIGN) signaling R-HSA-5621575	0.0922083198075985	4.25675981296695	2/21	1	NRAS;NFKB1
CD22 mediated BCR regulation R-HSA-5690714	1	0	0/4	1	
CD28 co-stimulation R-HSA-389356	0.132081456810096	3.36669148473906	2/26	1	CDC42;RICTOR
CD28 dependent PI3K/Akt signaling R-HSA-389357	0.344395243375533	2.50494933943993	1/17	1	RICTOR
CD28 dependent Vav1 pathway R-HSA-389359	0.200118620031579	5.0170897843533	1/9	1	CDC42
CDC6 association with the ORC:origin complex R-HSA-68689	1	0	0/3	1	
CDH11 homotypic and heterotypic interactions R-HSA-9833576	0.116610297001326	10.0369720650775	1/5	1	CTNND1
CDK-mediated phosphorylation and removal of Cdc6 R-HSA-69017	1	0	0/72	1	
CHL1 interactions R-HSA-447041	1	0	0/5	1	
CLEC7A (Dectin-1) induces NFAT activation R-HSA-5607763	1	0	0/9	1	
CLEC7A (Dectin-1) signaling R-HSA-5607764	0.897845471209094	0.43713730375868	1/91	1	NFKB1
CLEC7A/inflammasome pathway R-HSA-5660668	0.138263077540289	8.02961050373643	1/6	1	NFKB1
COPI-dependent Golgi-to-ER retrograde traffic R-HSA-6811434	1	0	0/55	1	
COPI-independent Golgi-to-ER retrograde traffic R-HSA-6811436	1	0	0/36	1	
COPI-mediated anterograde transport R-HSA-6807878	1	0	0/69	1	
COPII-mediated vesicle transport R-HSA-204005	1	0	0/32	1	
COX reactions R-HSA-140180	1	0	0/1	1	
CREB phosphorylation R-HSA-199920	1	0	0/7	1	
CREB1 phosphorylation through NMDA receptor-mediated activation of RAS signaling R-HSA-442742	0.406548576822922	2.00206904638143	1/21	1	NRAS
CREB1 phosphorylation through the activation of Adenylate Cyclase R-HSA-442720	1	0	0/7	1	
CREB1 phosphorylation through the activation of CaMKII/CaMKK/CaMKIV cascasde R-HSA-442729	1	0	0/6	1	
CREB3 factors activate genes R-HSA-8874211	1	0	0/4	1	
CRMPs in Sema3A signaling R-HSA-399956	1	0	0/8	1	
CS/DS degradation R-HSA-2024101	1	0	0/6	1	
CTLA4 inhibitory signaling R-HSA-389513	1	0	0/15	1	
CTNNB1 S33 mutants aren't phosphorylated R-HSA-5358747	1	0	0/11	1	
CTNNB1 S37 mutants aren't phosphorylated R-HSA-5358749	1	0	0/11	1	
CTNNB1 S45 mutants aren't phosphorylated R-HSA-5358751	1	0	0/11	1	
CTNNB1 T41 mutants aren't phosphorylated R-HSA-5358752	1	0	0/11	1	
CYP2E1 reactions R-HSA-211999	1	0	0/3	1	
Ca-dependent events R-HSA-111996	1	0	0/23	1	
Ca2+ activated K+ channels R-HSA-1296052	1	0	0/2	1	
Ca2+ pathway R-HSA-4086398	1	0	0/33	1	
CaM pathway R-HSA-111997	1	0	0/21	1	
CaMK IV-mediated phosphorylation of CREB R-HSA-111932	1	0	0/8	1	
Calcineurin activates NFAT R-HSA-2025928	1	0	0/9	1	
Calmodulin induced events R-HSA-111933	1	0	0/21	1	
Calnexin/calreticulin cycle R-HSA-901042	1	0	0/14	1	
Cam-PDE 1 activation R-HSA-111957	1	0	0/2	1	
Cap-dependent Translation Initiation R-HSA-72737	1	0	0/97	1	
