p.value	odds_ratio	overlap	adj_p.value	genes
Prostacyclin signalling through prostacyclin receptor R-HSA-392851	1	0	0/8	1	
Prostanoid ligand receptors R-HSA-391908	1	0	0/0	1	
Protein folding R-HSA-391251	1	0	0/63	1	
Protein hydroxylation R-HSA-9629569	1	0	0/7	1	
Protein lipoylation R-HSA-9857492	1	0	0/3	1	
Protein localization R-HSA-9609507	1	0	0/71	1	
Protein methylation R-HSA-8876725	1	0	0/8	1	
Protein repair R-HSA-5676934	1	0	0/2	1	
Protein ubiquitination R-HSA-8852135	1	0	0/49	1	
Protein-protein interactions at synapses R-HSA-6794362	1	0	0/20	1	
Proton-coupled monocarboxylate transport R-HSA-433692	1	0	0/2	1	
Proton-coupled neutral amino acid transporters R-HSA-428559	1	0	0/0	1	
Proton/oligopeptide cotransporters R-HSA-427975	1	0	0/0	1	
Purine catabolism R-HSA-74259	1	0	0/9	1	
Purine ribonucleoside monophosphate biosynthesis R-HSA-73817	1	0	0/4	1	
Purine salvage R-HSA-74217	1	0	0/7	1	
Purinergic signaling in leishmaniasis infection R-HSA-9660826	0.449301491930106	1.73970235420524	1/24	1	NFKB1
Pyrimidine biosynthesis R-HSA-500753	1	0	0/1	1	
Pyrimidine catabolism R-HSA-73621	1	0	0/7	1	
Pyrimidine salvage R-HSA-73614	1	0	0/3	1	
Pyrophosphate hydrolysis R-HSA-71737	1	0	0/2	1	
Pyroptosis R-HSA-5620971	1	0	0/14	1	
Pyruvate metabolism R-HSA-70268	0.275804974610652	3.34253800995413	1/13	1	PDK2
RA biosynthesis pathway R-HSA-5365859	1	0	0/5	1	
RAB GEFs exchange GTP for GDP on RABs R-HSA-8876198	1	0	0/20	1	
RAB geranylgeranylation R-HSA-8873719	1	0	0/10	1	
RAC1 GTPase cycle R-HSA-9013149	0.0373543079820065	2.90101601078747	5/76	1	CDC42;TRIO;SPATA13;IQGAP2;ARHGAP20
RAC2 GTPase cycle R-HSA-9013404	0.265561336872791	2.06442859250254	2/41	1	CDC42;TRIO
RAC3 GTPase cycle R-HSA-9013423	0.302172375222059	1.87066933725177	2/45	1	CDC42;TRIO
RAF activation R-HSA-5673000	0.0998656265904723	4.04361097501896	2/22	1	BRAF;NRAS
RAF-independent MAPK1/3 activation R-HSA-112409	1	0	0/12	1	
RAF/MAP kinase cascade R-HSA-5673001	0.0730760261135194	2.02247265362661	7/150	1	BRAF;NRAS;MAPK12;PTK2;ERBB3;SPRED2;PTPN3
RAS GTPase cycle mutants R-HSA-9649913	0.0716761816406873	20.053402141104	1/3	1	NRAS
RAS processing R-HSA-9648002	0.275804974610652	3.34253800995413	1/13	1	NRAS
RET signaling R-HSA-8853659	1	0	0/22	1	
RHO GTPase Effectors R-HSA-195258	0.737743872063217	0.79684250828409	4/202	1	CDC42;CENPC;PTK2;IQGAP2
RHO GTPase cycle R-HSA-9012999	0.030462589912188	2.11452215270692	10/209	1	CDC42;TRIO;SLC4A7;SPATA13;IQGAP2;WDR81;FGD4;SH3PXD2A;ARHGAP20;PTK2B
RHO GTPases Activate Formins R-HSA-5663220	0.523258173788101	1.1581787078263	2/71	1	CDC42;CENPC
RHO GTPases Activate NADPH Oxidases R-HSA-5668599	1	0	0/17	1	
RHO GTPases Activate ROCKs R-HSA-5627117	1	0	0/13	1	
RHO GTPases Activate Rhotekin and Rhophilins R-HSA-5666185	1	0	0/3	1	
RHO GTPases Activate WASPs and WAVEs R-HSA-5663213	0.123814015518646	3.51386549315412	2/25	1	CDC42;PTK2
RHO GTPases activate CIT R-HSA-5625900	1	0	0/11	1	
RHO GTPases activate IQGAPs R-HSA-5626467	0.17505585515538	2.78303026757756	2/31	1	CDC42;IQGAP2
RHO GTPases activate KTN1 R-HSA-5625970	0.138263077540289	8.02961050373643	1/6	1	CDC42
RHO GTPases activate PAKs R-HSA-5627123	0.31094443279378	2.86387318115518	1/15	1	CDC42
RHO GTPases activate PKNs R-HSA-5625740	1	0	0/80	1	
RHO GTPases regulate CFTR trafficking R-HSA-5627083	1	0	0/1	1	
RHOA GTPase cycle R-HSA-8980692	0.484168513327957	1.25024352778936	2/66	1	TRIO;ARHGAP20
RHOB GTPase cycle R-HSA-9013026	1	0	0/36	1	
RHOBTB GTPase Cycle R-HSA-9706574	1	0	0/22	1	
RHOBTB1 GTPase cycle R-HSA-9013422	1	0	0/15	1	
RHOBTB2 GTPase cycle R-HSA-9013418	1	0	0/14	1	
RHOBTB3 ATPase cycle R-HSA-9706019	1	0	0/4	1	
RHOC GTPase cycle R-HSA-9013106	1	0	0/40	1	
RHOD GTPase cycle R-HSA-9013405	0.435400637187904	1.81912800312983	1/23	1	SLC4A7
RHOF GTPase cycle R-HSA-9035034	0.360512668482516	2.35696161761655	1/18	1	SLC4A7
RHOG GTPase cycle R-HSA-9013408	0.035824185527452	4.53090650336964	3/30	1	CDC42;TRIO;IQGAP2
RHOH GTPase cycle R-HSA-9013407	0.344395243375533	2.50494933943993	1/17	1	SLC4A7
RHOJ GTPase cycle R-HSA-9013409	0.0422658532394857	4.21677251518497	3/32	1	CDC42;TRIO;SLC4A7
RHOQ GTPase cycle R-HSA-9013406	0.157579725496286	2.99055605014047	2/29	1	CDC42;SLC4A7
RHOT1 GTPase cycle R-HSA-9013425	1	0	0/1	1	
RHOT2 GTPase cycle R-HSA-9013419	1	0	0/1	1	
RHOU GTPase cycle R-HSA-9013420	0.132081456810096	3.36669148473906	2/26	1	CDC42;PTK2B
RHOV GTPase cycle R-HSA-9013424	0.391579993155526	2.10789506975962	1/20	1	CDC42
RIP-mediated NFkB activation via ZBP1 R-HSA-1810476	0.344395243375533	2.50494933943993	1/17	1	NFKB1
RIPK1-mediated regulated necrosis R-HSA-5213460	0.462863470113917	1.6668123440149	1/25	1	CFLAR
RMTs methylate histone arginines R-HSA-3214858	1	0	0/60	1	
RNA Pol II CTD phosphorylation and interaction with CE R-HSA-77075	1	0	0/19	1	
RNA Pol II CTD phosphorylation and interaction with CE during HIV infection R-HSA-167160	1	0	0/19	1	
RNA Polymerase I Promoter Clearance R-HSA-73854	1	0	0/86	1	
RNA Polymerase I Promoter Escape R-HSA-73772	1	0	0/70	1	
RNA Polymerase I Promoter Opening R-HSA-73728	1	0	0/57	1	
RNA Polymerase I Transcription Initiation R-HSA-73762	1	0	0/29	1	
RNA Polymerase I Transcription R-HSA-73864	1	0	0/87	1	
RNA Polymerase I Transcription Termination R-HSA-73863	1	0	0/15	1	
RNA Polymerase II HIV Promoter Escape R-HSA-167162	1	0	0/29	1	
RNA Polymerase II Pre-transcription Events R-HSA-674695	1	0	0/46	1	
RNA Polymerase II Promoter Escape R-HSA-73776	1	0	0/29	1	
RNA Polymerase II Transcription Elongation R-HSA-75955	1	0	0/34	1	
RNA Polymerase II Transcription Initiation And Promoter Clearance R-HSA-76042	1	0	0/29	1	
RNA Polymerase II Transcription Initiation R-HSA-75953	1	0	0/29	1	
RNA Polymerase II Transcription Pre-Initiation And Promoter Opening R-HSA-73779	1	0	0/29	1	
RNA Polymerase II Transcription R-HSA-73857	0.985961887415438	0.526415647747029	10/704	1	MDM2;NFKB1;TFAP2A;WWOX;TFAP2C;RICTOR;NCOR2;MYBL2;SGK1;CCNG1
RNA Polymerase II Transcription Termination R-HSA-73856	1	0	0/30	1	
RNA Polymerase III Abortive And Retractive Initiation R-HSA-749476	1	0	0/22	1	
RNA Polymerase III Chain Elongation R-HSA-73780	1	0	0/8	1	
RNA Polymerase III Transcription Initiation From Type 1 Promoter R-HSA-76061	1	0	0/15	1	
RNA Polymerase III Transcription Initiation From Type 2 Promoter R-HSA-76066	1	0	0/14	1	
RNA Polymerase III Transcription Initiation From Type 3 Promoter R-HSA-76071	1	0	0/12	1	
RNA Polymerase III Transcription Initiation R-HSA-76046	1	0	0/18	1	
RNA Polymerase III Transcription R-HSA-74158	1	0	0/22	1	
RNA Polymerase III Transcription Termination R-HSA-73980	1	0	0/12	1	
RNA polymerase II transcribes snRNA genes R-HSA-6807505	1	0	0/48	1	
RND1 GTPase cycle R-HSA-9696273	1	0	0/14	1	
RND2 GTPase cycle R-HSA-9696270	1	0	0/15	1	
RND3 GTPase cycle R-HSA-9696264	1	0	0/15	1	
ROBO receptors bind AKAP5 R-HSA-9010642	1	0	0/6	1	
RORA activates gene expression R-HSA-1368082	1	0	0/16	1	
ROS and RNS production in phagocytes R-HSA-1222556	1	0	0/16	1	
RPIA deficiency: failed conversion of R5P to RU5P R-HSA-5659996	1	0	0/1	1	
RPIA deficiency: failed conversion of RU5P to R5P R-HSA-6791461	1	0	0/1	1	
RSK activation R-HSA-444257	1	0	0/6	1	
RSV-host interactions R-HSA-9833110	1	0	0/68	1	
RUNX1 and FOXP3 control the development of regulatory T lymphocytes (Tregs) R-HSA-8877330	1	0	0/5	1	
RUNX1 interacts with co-factors whose precise effect on RUNX1 targets is not known R-HSA-8939243	1	0	0/28	1	
RUNX1 regulates estrogen receptor mediated transcription R-HSA-8931987	1	0	0/6	1	
RUNX1 regulates expression of components of tight junctions R-HSA-8935964	1	0	0/3	1	
RUNX1 regulates genes involved in megakaryocyte differentiation and platelet function R-HSA-8936459	1	0	0/78	1	
RUNX1 regulates transcription of genes involved in BCR signaling R-HSA-8939245	1	0	0/5	1	
RUNX1 regulates transcription of genes involved in WNT signaling R-HSA-8939256	1	0	0/5	1	
RUNX1 regulates transcription of genes involved in differentiation of HSCs R-HSA-8939236	1	0	0/121	1	
RUNX1 regulates transcription of genes involved in differentiation of keratinocytes R-HSA-8939242	1	0	0/3	1	
RUNX1 regulates transcription of genes involved in differentiation of myeloid cells R-HSA-8939246	1	0	0/6	1	
RUNX1 regulates transcription of genes involved in interleukin signaling R-HSA-8939247	1	0	0/4	1	
RUNX2 regulates bone development R-HSA-8941326	1	0	0/24	1	
RUNX2 regulates chondrocyte maturation R-HSA-8941284	1	0	0/5	1	
RUNX2 regulates genes involved in cell migration R-HSA-8941332	1	0	0/7	1	
RUNX2 regulates genes involved in differentiation of myeloid cells R-HSA-8941333	1	0	0/4	1	
RUNX2 regulates osteoblast differentiation R-HSA-8940973	1	0	0/19	1	
RUNX3 Regulates Immune Response and Cell Migration R-HSA-8949275	1	0	0/5	1	
RUNX3 regulates BCL2L11 (BIM) transcription R-HSA-8952158	1	0	0/5	1	
RUNX3 regulates CDKN1A transcription R-HSA-8941855	1	0	0/7	1	
RUNX3 regulates NOTCH signaling R-HSA-8941856	1	0	0/14	1	
RUNX3 regulates RUNX1-mediated transcription R-HSA-8951911	1	0	0/3	1	
RUNX3 regulates WNT signaling R-HSA-8951430	1	0	0/8	1	
RUNX3 regulates YAP1-mediated transcription R-HSA-8951671	1	0	0/6	1	
RUNX3 regulates p14-ARF R-HSA-8951936	1	0	0/10	1	
Rab regulation of trafficking R-HSA-9007101	1	0	0/34	1	
Rap1 signalling R-HSA-392517	1	0	0/8	1	
Ras activation upon Ca2+ influx through NMDA receptor R-HSA-442982	0.293590960101484	3.08479237796147	1/14	1	NRAS
Reactions specific to the complex N-glycan synthesis pathway R-HSA-975578	1	0	0/2	1	
Reactions specific to the hybrid N-glycan synthesis pathway R-HSA-975574	1	0	0/0	1	
Receptor Mediated Mitophagy R-HSA-8934903	1	0	0/8	1	
Receptor-type tyrosine-protein phosphatases R-HSA-388844	1	0	0/3	1	
Recognition and association of DNA glycosylase with site containing an affected purine R-HSA-110330	1	0	0/41	1	
Recognition and association of DNA glycosylase with site containing an affected pyrimidine R-HSA-110328	1	0	0/43	1	
Recognition of DNA damage by PCNA-containing replication complex R-HSA-110314	1	0	0/15	1	
Recruitment and ATM-mediated phosphorylation of repair and signaling proteins at DNA double strand breaks R-HSA-5693565	1	0	0/60	1	
Recruitment of NuMA to mitotic centrosomes R-HSA-380320	0.0470712488250082	3.15063089440838	4/56	1	ODF2;HAUS4;TUBGCP4;NUMA1
Recruitment of mitotic centrosome proteins and complexes R-HSA-380270	0.0777303831056293	3.2113187840616	3/41	1	ODF2;HAUS4;TUBGCP4
Recycling of eIF2:GDP R-HSA-72731	1	0	0/3	1	
Recycling pathway of L1 R-HSA-437239	1	0	0/36	1	
Reduction of cytosolic Ca++ levels R-HSA-418359	1	0	0/7	1	
Reelin signalling pathway R-HSA-8866376	1	0	0/3	1	
Regorafenib-resistant KIT mutants R-HSA-9669929	1	0	0/1	1	
Regorafenib-resistant PDGFR mutants R-HSA-9674403	1	0	0/1	1	
Regulated Necrosis R-HSA-5218859	0.621393007824728	1.04915150261877	1/39	1	CFLAR
Regulated proteolysis of p75NTR R-HSA-193692	0.200118620031579	5.0170897843533	1/9	1	NFKB1
Regulation by TREX1 R-HSA-3248023	1	0	0/0	1	
Regulation by c-FLIP R-HSA-3371378	0.219743962439726	4.45902578431031	1/10	1	CFLAR
Regulation of APC/C activators between G1/S and early anaphase R-HSA-176408	1	0	0/76	1	
Regulation of Apoptosis R-HSA-169911	1	0	0/49	1	
Regulation of BACH1 activity R-HSA-9708530	1	0	0/9	1	
Regulation of CDH11 Expression and Function R-HSA-9759475	0.0333765365488101	8.10193142304764	2/12	1	ADAM19;CTNND1
Regulation of CDH11 gene transcription R-HSA-9762293	1	0	0/6	1	
Regulation of CDH11 mRNA translation by microRNAs R-HSA-9759811	1	0	0/2	1	
Regulation of CDH19 Expression and Function R-HSA-9764302	0.0716761816406873	20.053402141104	1/3	1	CTNND1
Regulation of Complement cascade R-HSA-977606	1	0	0/21	1	
Regulation of Expression and Function of Type II Classical Cadherins R-HSA-9764260	0.0333765365488101	8.10193142304764	2/12	1	ADAM19;CTNND1
Regulation of FOXO transcriptional activity by acetylation R-HSA-9617629	1	0	0/10	1	
Regulation of FZD by ubiquitination R-HSA-4641263	1	0	0/13	1	
Regulation of Glucokinase by Glucokinase Regulatory Protein R-HSA-170822	1	0	0/10	1	
Regulation of HMOX1 expression and activity R-HSA-9707587	1	0	0/4	1	
Regulation of HSF1-mediated heat shock response R-HSA-3371453	1	0	0/38	1	
Regulation of Homotypic Cell-Cell Adhesion R-HSA-9759476	0.0333765365488101	8.10193142304764	2/12	1	ADAM19;CTNND1
Regulation of IFNA/IFNB signaling R-HSA-912694	1	0	0/26	1	
Regulation of IFNG signaling R-HSA-877312	1	0	0/14	1	
Regulation of KIT signaling R-HSA-1433559	1	0	0/13	1	
Regulation of MECP2 expression and activity R-HSA-9022692	0.391579993155526	2.10789506975962	1/20	1	NCOR2
Regulation of MITF-M dependent genes involved in invasion R-HSA-9854909	1	0	0/2	1	
Regulation of MITF-M dependent genes involved in metabolism R-HSA-9854907	1	0	0/3	1	
Regulation of MITF-M-dependent genes involved in DNA damage repair and senescence R-HSA-9825895	1	0	0/2	1	
Regulation of MITF-M-dependent genes involved in apoptosis R-HSA-9824594	1	0	0/7	1	
Regulation of MITF-M-dependent genes involved in cell cycle and proliferation R-HSA-9825892	1	0	0/12	1	
Regulation of MITF-M-dependent genes involved in lysosome biogenesis and autophagy R-HSA-9857377	1	0	0/13	1	
Regulation of MITF-M-dependent genes involved in pigmentation R-HSA-9824585	1	0	0/16	1	
Regulation of NF-kappa B signaling R-HSA-9758274	1	0	0/15	1	
Regulation of NFE2L2 gene expression R-HSA-9818749	0.180004762623178	5.73451948673135	1/8	1	NFKB1
Regulation of NPAS4 gene expression R-HSA-9768759	1	0	0/4	1	
Regulation of NPAS4 gene transcription R-HSA-9768777	1	0	0/3	1	
Regulation of NPAS4 mRNA translation R-HSA-9768778	1	0	0/1	1	
Regulation of PAK-2p34 activity by PS-GAP/RHG10 R-HSA-211728	1	0	0/1	1	
Regulation of PLK1 Activity at G2/M Transition R-HSA-2565942	0.338484070748653	1.70972583286839	2/49	1	ODF2;HAUS4
Regulation of PTEN gene transcription R-HSA-8943724	1	0	0/58	1	
Regulation of PTEN localization R-HSA-8948747	1	0	0/7	1	
Regulation of PTEN mRNA translation R-HSA-8943723	1	0	0/2	1	
Regulation of PTEN stability and activity R-HSA-8948751	1	0	0/59	1	
Regulation of RAS by GAPs R-HSA-5658442	0.400532991929452	1.48547937446455	2/56	1	NRAS;SPRED2
Regulation of RUNX1 Expression and Activity R-HSA-8934593	1	0	0/10	1	
Regulation of RUNX2 expression and activity R-HSA-8939902	1	0	0/65	1	
Regulation of RUNX3 expression and activity R-HSA-8941858	0.740076757700396	0.749371573533729	1/54	1	MDM2
Regulation of TBK1, IKKε (IKBKE)-mediated activation of IRF3, IRF7  R-HSA-9824878	1	0	0/11	1	
Regulation of TBK1, IKKε-mediated activation of IRF3, IRF7 upon TLR3 ligation R-HSA-9828211	1	0	0/10	1	
Regulation of TLR by endogenous ligand R-HSA-5686938	1	0	0/13	1	
Regulation of TNFR1 signaling R-HSA-5357905	0.560101313454734	1.24768986946656	1/33	1	CFLAR
Regulation of TP53 Activity R-HSA-5633007	0.207536854445201	1.76306311794709	4/96	1	MDM2;RICTOR;SGK1;CCNG1
Regulation of TP53 Activity through Acetylation R-HSA-6804758	1	0	0/23	1	
Regulation of TP53 Activity through Association with Co-factors R-HSA-6804759	1	0	0/7	1	
Regulation of TP53 Activity through Methylation R-HSA-6804760	0.257575809211835	3.64679299205737	1/12	1	MDM2
Regulation of TP53 Activity through Phosphorylation R-HSA-6804756	0.733465143880339	0.763976166167389	1/53	1	MDM2
Regulation of TP53 Expression R-HSA-6804754	1	0	0/2	1	
Regulation of actin dynamics for phagocytic cup formation R-HSA-2029482	0.219883740053785	2.37094555845883	2/36	1	CDC42;PTK2
Regulation of activated PAK-2p34 by proteasome mediated degradation R-HSA-211733	1	0	0/49	1	
Regulation of beta-cell development R-HSA-186712	0.406548576822922	2.00206904638143	1/21	1	IAPP
Regulation of cholesterol biosynthesis by SREBP (SREBF) R-HSA-1655829	0.537563527052307	1.33152259035122	1/31	1	ACACB
Regulation of commissural axon pathfinding by SLIT and ROBO R-HSA-428542	1	0	0/5	1	
Regulation of cortical dendrite branching R-HSA-8985801	1	0	0/2	1	
Regulation of cytoskeletal remodeling and cell spreading by IPP complex components R-HSA-446388	1	0	0/5	1	
Regulation of expression of SLITs and ROBOs R-HSA-9010553	1	0	0/143	1	
Regulation of gap junction activity R-HSA-191650	1	0	0/2	1	
Regulation of gene expression by Hypoxia-inducible Factor R-HSA-1234158	1	0	0/8	1	
Regulation of gene expression in beta cells R-HSA-210745	0.180004762623178	5.73451948673135	1/8	1	IAPP
Regulation of gene expression in early pancreatic precursor cells R-HSA-210747	1	0	0/1	1	
Regulation of gene expression in endocrine-committed (NEUROG3+) progenitor cells R-HSA-210746	1	0	0/0	1	
Regulation of gene expression in late stage (branching morphogenesis) pancreatic bud precursor cells R-HSA-210744	1	0	0/12	1	
Regulation of glycolysis by fructose 2,6-bisphosphate metabolism R-HSA-9634600	1	0	0/8	1	
Regulation of innate immune responses to cytosolic DNA R-HSA-3134975	1	0	0/9	1	
Regulation of insulin secretion R-HSA-422356	0.501596961931804	1.48052304495297	1/28	1	CACNB2
Regulation of lipid metabolism by PPARalpha R-HSA-400206	0.821811923266005	0.581840659939159	1/69	1	NCOR2
Regulation of localization of FOXO transcription factors R-HSA-9614399	1	0	0/12	1	
Regulation of mRNA stability by proteins that bind AU-rich elements R-HSA-450531	1	0	0/81	1	
Regulation of mitotic cell cycle R-HSA-453276	1	0	0/80	1	
Regulation of necroptotic cell death R-HSA-5675482	0.462863470113917	1.6668123440149	1/25	1	CFLAR
Regulation of ornithine decarboxylase (ODC) R-HSA-350562	1	0	0/49	1	
Regulation of pyruvate dehydrogenase (PDH) complex R-HSA-204174	0.116610297001326	10.0369720650775	1/5	1	PDK2
Regulation of pyruvate metabolism R-HSA-9861718	0.219743962439726	4.45902578431031	1/10	1	PDK2
Regulation of signaling by CBL R-HSA-912631	1	0	0/19	1	
Regulation of signaling by NODAL R-HSA-1433617	1	0	0/2	1	
Regulation of the apoptosome activity R-HSA-9627069	1	0	0/5	1	
Regulation of thyroid hormone activity R-HSA-350864	1	0	0/0	1	
Relaxin receptors R-HSA-444821	1	0	0/0	1	
Release of Hh-Np from the secreting cell R-HSA-5362798	1	0	0/3	1	
Release of apoptotic factors from the mitochondria R-HSA-111457	1	0	0/3	1	
Removal of aminoterminal propeptides from gamma-carboxylated proteins R-HSA-159782	1	0	0/3	1	
Removal of the Flap Intermediate R-HSA-69166	1	0	0/6	1	
Removal of the Flap Intermediate from the C-strand R-HSA-174437	1	0	0/6	1	
Replacement of protamines by nucleosomes in the male pronucleus R-HSA-9821993	1	0	0/34	1	
Replication of the SARS-CoV-1 genome R-HSA-9682706	1	0	0/4	1	
Replication of the SARS-CoV-2 genome R-HSA-9694686	1	0	0/4	1	
Repression of WNT target genes R-HSA-4641265	1	0	0/13	1	
Reproduction R-HSA-1474165	0.895222047512518	0.442163039806798	1/90	1	TFAP2C
Resistance of ERBB2 KD mutants to AEE788 R-HSA-9665250	1	0	0/2	1	
Resistance of ERBB2 KD mutants to afatinib R-HSA-9665249	1	0	0/2	1	
Resistance of ERBB2 KD mutants to lapatinib R-HSA-9665251	1	0	0/2	1	
Resistance of ERBB2 KD mutants to neratinib R-HSA-9665246	1	0	0/2	1	
Resistance of ERBB2 KD mutants to osimertinib R-HSA-9665247	1	0	0/2	1	
Resistance of ERBB2 KD mutants to sapitinib R-HSA-9665244	1	0	0/2	1	
Resistance of ERBB2 KD mutants to tesevatinib R-HSA-9665245	1	0	0/2	1	
Resistance of ERBB2 KD mutants to trastuzumab R-HSA-9665233	1	0	0/2	1	
Resolution of AP sites via the multiple-nucleotide patch replacement pathway R-HSA-110373	1	0	0/9	1	
Resolution of AP sites via the single-nucleotide replacement pathway R-HSA-110381	1	0	0/2	1	
Resolution of Abasic Sites (AP sites) R-HSA-73933	1	0	0/12	1	
Resolution of D-Loop Structures R-HSA-5693537	1	0	0/18	1	
Resolution of D-loop Structures through Holliday Junction Intermediates R-HSA-5693568	1	0	0/18	1	
Resolution of D-loop Structures through Synthesis-Dependent Strand Annealing (SDSA) R-HSA-5693554	1	0	0/15	1	
Resolution of Sister Chromatid Cohesion R-HSA-2500257	0.792728166140886	0.639126997381932	1/63	1	CENPC
Respiratory Syncytial Virus Infection Pathway R-HSA-9820952	1	0	0/85	1	
Respiratory electron transport R-HSA-611105	1	0	0/70	1	
Respiratory electron transport, ATP synthesis by chemiosmotic coupling, and heat production by uncoupling proteins. R-HSA-163200	1	0	0/85	1	
Respiratory syncytial virus (RSV) attachment and entry R-HSA-9820960	1	0	0/9	1	
Respiratory syncytial virus (RSV) genome replication, transcription and translation R-HSA-9820965	1	0	0/15	1	
Respiratory syncytial virus genome replication R-HSA-9834752	1	0	0/2	1	
Respiratory syncytial virus genome transcription R-HSA-9828642	1	0	0/1	1	
Response of EIF2AK1 (HRI) to heme deficiency R-HSA-9648895	1	0	0/14	1	
Response of EIF2AK4 (GCN2) to amino acid deficiency R-HSA-9633012	1	0	0/92	1	
Response of Mtb to phagocytosis R-HSA-9637690	1	0	0/14	1	
Response to elevated platelet cytosolic Ca2+ R-HSA-76005	0.150668784626074	2.33879303385702	3/55	1	PLG;IGF1;IGF2
Response to metal ions R-HSA-5660526	1	0	0/0	1	
Retinoid cycle disease events R-HSA-2453864	1	0	0/1	1	
Retinoid metabolism and transport R-HSA-975634	1	0	0/13	1	
Retinoid metabolism disease events R-HSA-6809583	1	0	0/0	1	
Retrograde neurotrophin signalling R-HSA-177504	1	0	0/8	1	
Retrograde transport at the Trans-Golgi-Network R-HSA-6811440	1	0	0/26	1	
Reuptake of GABA R-HSA-888593	1	0	0/2	1	
Rev-mediated nuclear export of HIV RNA R-HSA-165054	1	0	0/12	1	
Reversal of alkylation damage by DNA dioxygenases R-HSA-73943	1	0	0/0	1	
Reverse Transcription of HIV RNA R-HSA-162589	1	0	0/1	1	
Reversible hydration of carbon dioxide R-HSA-1475029	0.159390357214264	6.69070020831284	1/7	1	CA2
Rhesus blood group biosynthesis R-HSA-9037628	1	0	0/0	1	
Rhesus glycoproteins mediate ammonium transport. R-HSA-444411	1	0	0/0	1	
Ribavirin ADME R-HSA-9755088	1	0	0/5	1	
Ribosomal scanning and start codon recognition R-HSA-72702	1	0	0/47	1	
Role of ABL in ROBO-SLIT signaling R-HSA-428890	1	0	0/6	1	
Role of LAT2/NTAL/LAB on calcium mobilization R-HSA-2730905	1	0	0/12	1	
Role of phospholipids in phagocytosis R-HSA-2029485	1	0	0/16	1	
Role of second messengers in netrin-1 signaling R-HSA-418890	1	0	0/2	1	
S Phase R-HSA-69242	1	0	0/123	1	
SARS-CoV Infections R-HSA-9679506	0.989799397304763	0.294708323195772	2/260	1	NFKB1;ST3GAL1
SARS-CoV-1 Genome Replication and Transcription R-HSA-9679514	1	0	0/4	1	
SARS-CoV-1 Infection R-HSA-9678108	0.753540354203228	0.739614785541811	2/109	1	NFKB1;ST3GAL1
SARS-CoV-1 activates/modulates innate immune responses R-HSA-9692916	0.581551232790423	1.17371778561005	1/35	1	NFKB1
SARS-CoV-1 modulates host translation machinery R-HSA-9735869	1	0	0/33	1	
SARS-CoV-1 targets PDZ proteins in cell-cell junction R-HSA-9692912	1	0	0/0	1	
SARS-CoV-1 targets host intracellular signalling and regulatory pathways R-HSA-9735871	1	0	0/16	1	
SARS-CoV-1-host interactions R-HSA-9692914	0.884044633643088	0.463448370908955	1/86	1	NFKB1
SARS-CoV-1-mediated effects on programmed cell death R-HSA-9692913	1	0	0/3	1	
SARS-CoV-2 Genome Replication and Transcription R-HSA-9694682	1	0	0/4	1	
SARS-CoV-2 Infection R-HSA-9694516	0.989584218910919	0.214728814931834	1/180	1	ST3GAL1
SARS-CoV-2 activates/modulates innate and adaptive immune responses R-HSA-9705671	1	0	0/82	1	
SARS-CoV-2 modulates autophagy R-HSA-9754560	1	0	0/2	1	
SARS-CoV-2 modulates host translation machinery R-HSA-9754678	1	0	0/42	1	
SARS-CoV-2 targets PDZ proteins in cell-cell junction R-HSA-9705677	1	0	0/1	1	
SARS-CoV-2 targets host intracellular signalling and regulatory pathways R-HSA-9755779	1	0	0/12	1	
SARS-CoV-2-host interactions R-HSA-9705683	1	0	0/138	1	
SCF(Skp2)-mediated degradation of p27/p21 R-HSA-187577	1	0	0/58	1	
SCF-beta-TrCP mediated degradation of Emi1 R-HSA-174113	1	0	0/52	1	
SDK interactions R-HSA-373756	1	0	0/0	1	
SEMA3A-Plexin repulsion signaling by inhibiting Integrin adhesion R-HSA-399955	1	0	0/5	1	
SHC-mediated cascade:FGFR1 R-HSA-5654688	0.159390357214264	6.69070020831284	1/7	1	NRAS
SHC-mediated cascade:FGFR2 R-HSA-5654699	0.200118620031579	5.0170897843533	1/9	1	NRAS
SHC-mediated cascade:FGFR3 R-HSA-5654704	0.159390357214264	6.69070020831284	1/7	1	NRAS
SHC-mediated cascade:FGFR4 R-HSA-5654719	0.159390357214264	6.69070020831284	1/7	1	NRAS
SHC1 events in EGFR signaling R-HSA-180336	0.275804974610652	3.34253800995413	1/13	1	NRAS
SHC1 events in ERBB2 signaling R-HSA-1250196	0.0506423424093393	6.22921855381313	2/15	1	NRAS;ERBB3
SHC1 events in ERBB4 signaling R-HSA-1250347	0.200118620031579	5.0170897843533	1/9	1	NRAS
SHOC2 M1731 mutant abolishes MRAS complex function R-HSA-9726840	0.116610297001326	10.0369720650775	1/5	1	BRAF
SIRT1 negatively regulates rRNA expression R-HSA-427359	1	0	0/58	1	
SLBP Dependent Processing of Replication-Dependent Histone Pre-mRNAs R-HSA-77588	1	0	0/8	1	
SLBP independent Processing of Histone Pre-mRNAs R-HSA-111367	1	0	0/7	1	
SLC transporter disorders R-HSA-5619102	1	0	0/37	1	
SLIT2:ROBO1 increases RHOA activity R-HSA-8985586	1	0	0/3	1	
SMAC (DIABLO) binds to IAPs  R-HSA-111463	1	0	0/2	1	
SMAC(DIABLO)-mediated dissociation of IAP:caspase complexes  R-HSA-111464	1	0	0/2	1	
SMAC, XIAP-regulated apoptotic response R-HSA-111469	1	0	0/2	1	
SMAD2/3 MH2 Domain Mutants in Cancer R-HSA-3315487	1	0	0/3	1	
SMAD2/3 Phosphorylation Motif Mutants in Cancer R-HSA-3304356	1	0	0/6	1	
SMAD2/SMAD3:SMAD4 heterotrimer regulates transcription R-HSA-2173796	1	0	0/36	1	
SMAD4 MH2 Domain Mutants in Cancer R-HSA-3311021	1	0	0/3	1	
SOS-mediated signalling R-HSA-112412	0.159390357214264	6.69070020831284	1/7	1	NRAS
SRP-dependent cotranslational protein targeting to membrane R-HSA-1799339	1	0	0/94	1	
STAT3 nuclear events downstream of ALK signaling R-HSA-9701898	1	0	0/11	1	
STAT5 Activation R-HSA-9645135	1	0	0/5	1	
STAT5 activation downstream of FLT3 ITD mutants R-HSA-9702518	1	0	0/8	1	
STAT6-mediated induction of chemokines R-HSA-3249367	1	0	0/3	1	
STING mediated induction of host immune responses R-HSA-1834941	1	0	0/8	1	
SUMO E3 ligases SUMOylate target proteins R-HSA-3108232	0.360855808180896	1.34198231802217	4/124	1	MDM2;TFAP2A;TFAP2C;NCOR2
SUMO is conjugated to E1 (UBA2:SAE1) R-HSA-3065676	1	0	0/4	1	
SUMO is proteolytically processed R-HSA-3065679	1	0	0/4	1	
SUMO is transferred from E1 to E2 (UBE2I, UBC9) R-HSA-3065678	1	0	0/5	1	
SUMOylation R-HSA-2990846	0.372132399804092	1.31930913302884	4/126	1	MDM2;TFAP2A;TFAP2C;NCOR2
SUMOylation of DNA damage response and repair proteins R-HSA-3108214	1	0	0/44	1	
